{
  "$schema": "./aluminum-hts-scope.schema.json",
  "version": "2026-05-26.1",
  "description": "HTS codes within Section 232 aluminum scope (incl. derivatives). Per Proc 10895 + CSMS additions. Smelt/Cast reporting required for every entry from effectiveFrom forward.",
  "sourceDocuments": [
    "cbp.csms.55424218",
    "cbp.csms.55438432",
    "cbp.csms.65340246",
    "fr.proclamation.10895"
  ],
  "entries": [
    { "htsCode": "7601.10.3000", "effectiveFrom": "2018-03-23", "source": "fr.proclamation.9704" },
    { "htsCode": "7601.10.6000", "effectiveFrom": "2018-03-23", "source": "fr.proclamation.9704" },
    { "htsCode": "7601.20.3000", "effectiveFrom": "2018-03-23", "source": "fr.proclamation.9704" },
    { "htsCode": "7601.20.6000", "effectiveFrom": "2018-03-23", "source": "fr.proclamation.9704" },
    { "htsCode": "7601.20.9000", "effectiveFrom": "2018-03-23", "source": "fr.proclamation.9704" },
    { "htsCode": "7604.10.1000", "effectiveFrom": "2018-03-23", "source": "fr.proclamation.9704" },
    { "htsCode": "7604.10.3000", "effectiveFrom": "2018-03-23", "source": "fr.proclamation.9704" },
    { "htsCode": "7604.10.5000", "effectiveFrom": "2018-03-23", "source": "fr.proclamation.9704" },
    { "htsCode": "7604.21.0010", "effectiveFrom": "2018-03-23", "source": "fr.proclamation.9704" },
    { "htsCode": "7604.21.0090", "effectiveFrom": "2018-03-23", "source": "fr.proclamation.9704" },
    { "htsCode": "7604.29.1010", "effectiveFrom": "2018-03-23", "source": "fr.proclamation.9704" },
    { "htsCode": "7604.29.1090", "effectiveFrom": "2018-03-23", "source": "fr.proclamation.9704" },
    { "htsCode": "7604.29.3010", "effectiveFrom": "2018-03-23", "source": "fr.proclamation.9704" },
    { "htsCode": "7604.29.3050", "effectiveFrom": "2018-03-23", "source": "fr.proclamation.9704" },
    { "htsCode": "7604.29.5050", "effectiveFrom": "2018-03-23", "source": "fr.proclamation.9704" },
    { "htsCode": "7604.29.5090", "effectiveFrom": "2018-03-23", "source": "fr.proclamation.9704" },
    { "htsCode": "7605.11.0000", "effectiveFrom": "2018-03-23", "source": "fr.proclamation.9704" },
    { "htsCode": "7605.19.0000", "effectiveFrom": "2018-03-23", "source": "fr.proclamation.9704" },
    { "htsCode": "7605.21.0000", "effectiveFrom": "2018-03-23", "source": "fr.proclamation.9704" },
    { "htsCode": "7605.29.0000", "effectiveFrom": "2018-03-23", "source": "fr.proclamation.9704" },
    { "htsCode": "7606.11.3060", "effectiveFrom": "2018-03-23", "source": "fr.proclamation.9704" },
    { "htsCode": "7606.11.6000", "effectiveFrom": "2018-03-23", "source": "fr.proclamation.9704" },
    { "htsCode": "7606.12.3010", "effectiveFrom": "2018-03-23", "source": "fr.proclamation.9704" },
    { "htsCode": "7606.12.3025", "effectiveFrom": "2018-03-23", "source": "fr.proclamation.9704" },
    { "htsCode": "7606.12.3035", "effectiveFrom": "2018-03-23", "source": "fr.proclamation.9704" },
    { "htsCode": "7606.12.3091", "effectiveFrom": "2018-03-23", "source": "fr.proclamation.9704" },
    { "htsCode": "7606.12.6000", "effectiveFrom": "2018-03-23", "source": "fr.proclamation.9704" },
    { "htsCode": "7606.91.3000", "effectiveFrom": "2018-03-23", "source": "fr.proclamation.9704" },
    { "htsCode": "7606.91.6080", "effectiveFrom": "2018-03-23", "source": "fr.proclamation.9704" },
    { "htsCode": "7606.92.3000", "effectiveFrom": "2018-03-23", "source": "fr.proclamation.9704" },
    { "htsCode": "7606.92.6080", "effectiveFrom": "2018-03-23", "source": "fr.proclamation.9704" },
    { "htsCode": "7607.11.3000", "effectiveFrom": "2018-03-23", "source": "fr.proclamation.9704" },
    { "htsCode": "7607.11.6090", "effectiveFrom": "2018-03-23", "source": "fr.proclamation.9704" },
    { "htsCode": "7607.19.6000", "effectiveFrom": "2018-03-23", "source": "fr.proclamation.9704" },
    { "htsCode": "7608.10.0030", "effectiveFrom": "2018-03-23", "source": "fr.proclamation.9704" },
    { "htsCode": "7608.20.0030", "effectiveFrom": "2018-03-23", "source": "fr.proclamation.9704" },
    { "htsCode": "7609.00.0000", "effectiveFrom": "2018-03-23", "source": "fr.proclamation.9704" },
    { "htsCode": "7616.99.5160", "effectiveFrom": "2018-03-23", "source": "fr.proclamation.9704" },
    { "htsCode": "7616.99.5170", "effectiveFrom": "2018-03-23", "source": "fr.proclamation.9704" },

    { "htsCode": "7616.99.5120", "effectiveFrom": "2025-03-12", "source": "fr.proclamation.10895", "note": "Added by Proc 10895 derivative expansion" },
    { "htsCode": "7616.99.5130", "effectiveFrom": "2025-03-12", "source": "fr.proclamation.10895" },
    { "htsCode": "7616.99.5140", "effectiveFrom": "2025-03-12", "source": "fr.proclamation.10895" },
    { "htsCode": "7616.99.5180", "effectiveFrom": "2025-03-12", "source": "fr.proclamation.10895" },
    { "htsCode": "7616.99.5190", "effectiveFrom": "2025-03-12", "source": "fr.proclamation.10895" },

    { "htsCode": "8302.49.6085", "effectiveFrom": "2025-03-12", "source": "fr.proclamation.10895", "note": "The HTS that motivated Phase 2 (gap fix)" },
    { "htsCode": "8302.10.6030", "effectiveFrom": "2025-03-12", "source": "fr.proclamation.10895" },
    { "htsCode": "8302.41.3000", "effectiveFrom": "2025-03-12", "source": "fr.proclamation.10895" },
    { "htsCode": "8302.41.6015", "effectiveFrom": "2025-03-12", "source": "fr.proclamation.10895" },
    { "htsCode": "8302.41.6045", "effectiveFrom": "2025-03-12", "source": "fr.proclamation.10895" },
    { "htsCode": "8302.41.6080", "effectiveFrom": "2025-03-12", "source": "fr.proclamation.10895" },

    { "htsCode": "8418.99.8060", "effectiveFrom": "2025-03-12", "source": "fr.proclamation.10895" },
    { "htsCode": "8479.89.9499", "effectiveFrom": "2025-03-12", "source": "fr.proclamation.10895" },
    { "htsCode": "9403.20.0090", "effectiveFrom": "2025-03-12", "source": "fr.proclamation.10895" },
    { "htsCode": "9403.99.9020", "effectiveFrom": "2025-03-12", "source": "fr.proclamation.10895" }
  ]
}
